{
  "format": "starhop-linear-value-v1",
  "trained": true,
  "license": "MIT",
  "featureVersion": "h-transport-phase-v1",
  "featureNames": [
    "early.assignment",
    "early.lagSquared",
    "early.homeRemaining",
    "early.arrived",
    "early.ownBridges",
    "early.jumpTransport",
    "late.assignment",
    "late.lagSquared",
    "late.homeRemaining",
    "late.arrived",
    "late.ownBridges",
    "late.jumpTransport"
  ],
  "featureScales": [
    100,
    500,
    10,
    10,
    16,
    30,
    100,
    500,
    10,
    10,
    16,
    30
  ],
  "phase": "clamp((max(arrivedOwn,arrivedOpponent)-4)/6,0,1)",
  "bias": 0,
  "theta": [
    0.2986843970129697,
    0.29822284137782884,
    0.2929055601307508,
    0.2987127600904501,
    0.2962324091980292,
    0.29483008697582963,
    0.2979844572397014,
    0.29763126824784875,
    0.1856354582411338,
    0.29838424846629635,
    0.2965587511292718,
    0.2948469636891065
  ],
  "scoreScale": 100,
  "scoreWeights": [
    0.2986843970129697,
    0.059644568275565774,
    2.929055601307508,
    2.987127600904501,
    1.8514525574876823,
    0.9827669565860987,
    0.2979844572397014,
    0.05952625364956975,
    1.8563545824113383,
    2.9838424846629636,
    1.853492194557949,
    0.9828232122970216
  ],
  "training": {
    "method": "full-batch Adam logistic outcome regression with L2, zero initialization, validation checkpoint",
    "seed": 20261010,
    "epochs": 400,
    "rate": 0.03,
    "ridge": 0.001,
    "stride": 3,
    "minPly": 8,
    "bestEpoch": 10,
    "outcomeLabels": "Legal replay winner from current side perspective; genuine rule draws target 0.5; capped/incomplete records excluded",
    "gameWeighting": "Every unique game has total weight one",
    "splitPolicy": "Entire paired opening board plus rules kept together; no position-level split",
    "dataPolicy": "Only local benchmark ai-ai records; fixture-derived/human records excluded. Frozen continuations, step gaps and engine search scores are never training inputs or labels.",
    "inputFiles": 52,
    "uniqueGames": 50,
    "duplicateFiles": 0,
    "excludedFiles": 2,
    "groups": {
      "train": 10,
      "validation": 2,
      "test": 2
    },
    "sampleCounts": {
      "train": 1171,
      "validation": 358,
      "test": 120
    },
    "extractionMs": 98.2375,
    "optimizationMs": 33.52109999999999
  },
  "metrics": {
    "initialTrain": {
      "gamesEquivalent": 35.00000000000015,
      "positions": 1171,
      "logLoss": 0.6931471805599352,
      "brier": 0.22857142857142979,
      "outcomeAccuracy": 0.503353212046895
    },
    "train": {
      "gamesEquivalent": 35.00000000000015,
      "positions": 1171,
      "logLoss": 0.6705867421724544,
      "brier": 0.21732407155504116,
      "outcomeAccuracy": 0.7180024135978917
    },
    "initialValidation": {
      "gamesEquivalent": 11.000000000000034,
      "positions": 358,
      "logLoss": 0.6931471805599436,
      "brier": 0.22727272727272677,
      "outcomeAccuracy": 0.5061830123899076
    },
    "validation": {
      "gamesEquivalent": 11.000000000000034,
      "positions": 358,
      "logLoss": 0.6894641178097514,
      "brier": 0.22543928315918577,
      "outcomeAccuracy": 0.575548177203937
    },
    "test": {
      "gamesEquivalent": 3.9999999999999916,
      "positions": 120,
      "logLoss": 0.6862509074195906,
      "brier": 0.18405563171032302,
      "outcomeAccuracy": 0.6558115719406054
    }
  },
  "provenance": {
    "trainerSha256": "78c4684866a809b051cbfbfa6da6aa6f7465316d008cec05101df0574754e2e8",
    "featureSourceSha256": "be127ac029fa7603a6a4d9153648bee5ab675786c57e3f5c3bcc5051bf8cb74a",
    "featureKernelSha256": "cb51ec99a8319efc70171fdf3d4f3f6e0089cb2f58c9b42563570fc478fb9733",
    "rulesSha256": "81c0d0af574455256e99eada46a5533f304634390219d235b8587ae1f890a082",
    "datasetSha256": "cc044e95f0dc6a53d30bccb8d3bc20fbb82d4dfe73537d1e094a0e802599b4ae",
    "games": [
      {
        "id": "375b908feb0670b6f96e12a6a882fb3ccce43cb6fa4cc33b8c7d2fa37d42d9ed",
        "group": "414a8e5d3d33c385718a570ee9ac190d6749c7ec5617e2b9a3873e071ebb1fe2",
        "split": "train",
        "winner": 0,
        "draw": null,
        "plies": 90,
        "openingPlies": 8,
        "sources": [
          {
            "file": "docs/benchmarks/2026-10-10/candidate-a-equal350/game-1.json",
            "sha256": "6870fa8c3b42acdbe4237652f3b7cfb7213922e971c8e3e24ef37e460f8f9228"
          }
        ]
      },
      {
        "id": "56f992e9a9d14e1be1dcbf4b9dd2ef70cd660f69a2b83e3785fe2c84cbf2dbea",
        "group": "414a8e5d3d33c385718a570ee9ac190d6749c7ec5617e2b9a3873e071ebb1fe2",
        "split": "train",
        "winner": 0,
        "draw": null,
        "plies": 90,
        "openingPlies": 8,
        "sources": [
          {
            "file": "docs/benchmarks/2026-10-10/candidate-a-equal350/game-2.json",
            "sha256": "fd203ddecd25996bc71c8c07b71445cbdfc4dd060c3b7b533c77ebd81df2d06c"
          }
        ]
      },
      {
        "id": "fb456f54704a7bd9d2528d1962095ad9c0bb7b761623b780c6b1db4bb449cd08",
        "group": "f4bd4c093b0a7cf0210c620e08fa3ab882767aa938ccfda84feaa8ff0086be2b",
        "split": "validation",
        "winner": null,
        "draw": "三次重复局面",
        "plies": 108,
        "openingPlies": 8,
        "sources": [
          {
            "file": "docs/benchmarks/2026-10-10/candidate-a-equal350/game-3.json",
            "sha256": "1afb329613d0bca48b3c306ef9f2d9f4d2872e9a9814c1f3bcdc14d911d271cc"
          }
        ]
      },
      {
        "id": "14d414d014c5c9bcdd7609633ae107b622e5628d50b20b7c64ca92293bda9047",
        "group": "f4bd4c093b0a7cf0210c620e08fa3ab882767aa938ccfda84feaa8ff0086be2b",
        "split": "validation",
        "winner": 3,
        "draw": null,
        "plies": 95,
        "openingPlies": 8,
        "sources": [
          {
            "file": "docs/benchmarks/2026-10-10/candidate-a-equal350/game-4.json",
            "sha256": "d770b2010d49555517adf66ac823f0ceea583c778ae17dcaf13aeea487988beb"
          }
        ]
      },
      {
        "id": "b7badcf19b1db85c47d07727fcc323bef207654c1063fe21fa60de250f497c08",
        "group": "798577373e0c5476dadd5750f6fad2814379e996a290eca229d3f61f3153f417",
        "split": "train",
        "winner": null,
        "draw": "三次重复局面",
        "plies": 97,
        "openingPlies": 8,
        "sources": [
          {
            "file": "docs/benchmarks/2026-10-10/candidate-a-equal350/game-5.json",
            "sha256": "ef81c53b907013a820c114a1840e0ce834b1b2f702e00a487423e6a32054a7ec"
          }
        ]
      },
      {
        "id": "a38f2d071aac7cd652e78e836c1f222e14153e6aecf146934d99c8af89363660",
        "group": "798577373e0c5476dadd5750f6fad2814379e996a290eca229d3f61f3153f417",
        "split": "train",
        "winner": 3,
        "draw": null,
        "plies": 113,
        "openingPlies": 8,
        "sources": [
          {
            "file": "docs/benchmarks/2026-10-10/candidate-a-equal350/game-6.json",
            "sha256": "67528d39464e5cf73399bcc53098520f7dbd5820f6b3076e9b29998491f50946"
          }
        ]
      },
      {
        "id": "95dbd26d5863bb48c4d7d7379805840e4b5e466051bd5388ad57d9d84de02510",
        "group": "128df8a9f08bab7db8c0cbd04e4aaff65f27a4f1e9daf3c7564a82355fe20e32",
        "split": "test",
        "winner": 0,
        "draw": null,
        "plies": 100,
        "openingPlies": 8,
        "sources": [
          {
            "file": "docs/benchmarks/2026-10-10/candidate-a-equal350/game-7.json",
            "sha256": "8c4ae909a7968e745fcc91d942d0616a3c19306aa41aadcaaf6ba8f54016ac11"
          }
        ]
      },
      {
        "id": "e423c1a035a6c6f885488a094229b45ce7afa2635bcc73148453029785b793d4",
        "group": "128df8a9f08bab7db8c0cbd04e4aaff65f27a4f1e9daf3c7564a82355fe20e32",
        "split": "test",
        "winner": null,
        "draw": "三次重复局面",
        "plies": 101,
        "openingPlies": 8,
        "sources": [
          {
            "file": "docs/benchmarks/2026-10-10/candidate-a-equal350/game-8.json",
            "sha256": "290265ce41b2230b17703882dce02c812cc14e284325a96152af8ebe489e8cfd"
          }
        ]
      },
      {
        "id": "57f7133736292bdd2c33f37e3c4f60691bf3b3f296f0136e2f4feab2ccfdc363",
        "group": "6093da884b46297f20b94aee19682bcb114aeb5708d8a9809086bc2699d2cfa1",
        "split": "train",
        "winner": 3,
        "draw": null,
        "plies": 113,
        "openingPlies": 8,
        "sources": [
          {
            "file": "docs/benchmarks/2026-10-10/candidate-b-heldout350/game-1.json",
            "sha256": "7f53644aeb942d0600a758135e28dd3ef5437594438036dac105086ba25f9340"
          }
        ]
      },
      {
        "id": "328b219599b5973f4c7f8e6f7d692f30c36b1912f51a1750c4ae86e2d73fb964",
        "group": "6093da884b46297f20b94aee19682bcb114aeb5708d8a9809086bc2699d2cfa1",
        "split": "train",
        "winner": 3,
        "draw": null,
        "plies": 101,
        "openingPlies": 8,
        "sources": [
          {
            "file": "docs/benchmarks/2026-10-10/candidate-b-heldout350/game-2.json",
            "sha256": "7a1edede5eb03ed56d481bde359b45c8f091277161e814ef48527a4d73486dfb"
          }
        ]
      },
      {
        "id": "fa4894363f4696959ea3f9d8c7d48fda15f41144babe24b1aea592107aea43bf",
        "group": "17e34d4fe0d6e81b40a8a7220d201e8450fb82a86479747c079b66ed3735596d",
        "split": "train",
        "winner": 0,
        "draw": null,
        "plies": 94,
        "openingPlies": 8,
        "sources": [
          {
            "file": "docs/benchmarks/2026-10-10/candidate-b-heldout350/game-3.json",
            "sha256": "8af482daa74e4509247f8f1fb88ebde89c3af5f295bce7134c7cc75669de7d27"
          }
        ]
      },
      {
        "id": "ea0e70c452fb3c1b6e77b3bf4280b43ea2a790c61dfcc33bb9a71cfbcdef4156",
        "group": "17e34d4fe0d6e81b40a8a7220d201e8450fb82a86479747c079b66ed3735596d",
        "split": "train",